authors,body,datetime,news_site,title,url
Phil Helsel,"An Indianapolis sports columnist has apologized for flashing a heart symbol with his hands, as well as for his subsequent comments, to new Indiana Fever player Caitlin Clark in what soon became an “ awkward ” interaction.Indianapolis Star columnist Gregg Doyel made the heart symbol while he was speaking to Clark at her introductory news conference with the WNBA team, to which she responded, “You like that?” Doyel replied, “I like that you’re here.”Clark, who broke the NCAA scoring record for both women and men as an Iowa Hawkeye and  was the No. 1 pick  in  Monday’s WNBA draft , said, “I do that at my family after every game, so it’s pretty cool.”“OK, well, start doing it to me and we’ll get along just fine,” Doyel replied, before he asked a question about Clark’s decision to turn pro and enter the draft.Doyel apologized in a column published online Wednesday night.“I’m devastated to realize I’m part of the problem,” he wrote.Doyel said he is known for having awkward conversations with people before asking “brashly conversational questions.” He’d done so for years with Indianapolis Colts coaches, as well as with Purdue University and Indiana University players, he wrote. He called himself “another insensitive man” and said he offended Clark and her family while trying to be “clever” and “welcoming.” “After going through denial, and then anger — I’m on the wrong side of this? Me??? — I now realize what I said and how I said it was wrong, wrong, wrong. I mean it was just wrong,” Doyel wrote. “Caitlin Clark, I’m so sorry.”Clark and her representatives could not immediately be reached for comment late Wednesday.Clark, 22, broke the women’s NCAA all-time scoring record in February and then  broke the men’s record  a month later. She ended with 3,951 career points.With Clark playing, the women’s NCAA championship game between the Hawkeyes and the South Carolina Gamecocks drew  more viewers than the men’s championship game  for the first time.Iowa lost to South Carolina for the title, but Gamecocks coach Dawn Staley singled out Clark for lifting up women’s basketball.Clark has since made multiple high-profile media appearances, including on NBC’s  “TODAY”  and  “Saturday Night Live.”  In another sign of fans’ excitement, her Indiana Fever jersey became the  top-selling jersey ever for a draft pick .",2024-04-18 14:05:00 PM EEST,NBC,Indianapolis columnist apologizes to Caitlin Clark over 'awkward' heart gesture,https://www.nbcnews.com/news/sports/columnist-apologizes-caitlin-clark-heart-gesture-rcna148326
"Matthew Grimson,JoElla Carman,Jiachuan Wu","Faster. Higher. Stronger.  Floatier?As times have changed, so, too, has the Olympic program.When Paris first hosted in 1900, croquet and tug-of-war were featured (that was croquet’s only Olympics appearance, while tug-of-war was featured five more times until the Games in Antwerp, Belgium, in 1920).Contests of all kinds have come and gone and sometimes returned over the years — a trend that will continue thanks to the International Olympic Committee’s allowing host countries to nominate one-off events that “ enhance the popularity of the Games .” So, what’s new this year? And what will be in the lineup at Los Angeles 2028? Two sports below are set to make their Olympic debuts, while several are making returns. Others are but office daydreams.  Go for gold and test your knowledge of the Olympic program.",2024-04-17 12:00:00 PM EEST,NBC,Quiz: Is this an Olympic sport?,https://www.nbcnews.com/sports/olympics/sports-paris-2024-quiz-rcna147894
The Associated Press,"LOS ANGELES — Carl Erskine, who pitched two no-hitters as a mainstay on the Brooklyn Dodgers and was a 20-game winner in 1953 when he struck out a then-record 14 in the World Series, died Tuesday. He was 97.Erksine died at Community Hospital Anderson in his hometown of Anderson, Indiana, according to Michele Hockwalt, the hospital’s marketing and communication manager.Among the last survivors from the celebrated Brooklyn teams of the 1950s, Erskine spent his entire major league career with the Dodgers from 1948-59, helping them win five National League pennants.The right-hander had a career record of 122-78 and an ERA of 4.00, with 981 strikeouts.Erskine had his best season in 1953, when he went 20-6 to lead the National League. He won Game 3 of the World Series, beating the Yankees 3-2 at Ebbets Field. He struck out 14, retiring the side in the ninth, for a record that stood until Dodgers ace Sandy Koufax got 15 in 1963. The Dodgers went on to lose in six games as the Yankees won their fifth consecutive championship.Erskine was an All-Star in 1954, when he won 18 games.He appeared in five World Series, with the Dodgers finally beating the Yankees in 1955 for their only championship in Brooklyn. He gave up a home run to Gil McDougald in the first inning of Game 4 and left after 3 2/3 innings. The Dodgers went on to win 8-5.Erskine’s death leaves the 88-year-old Koufax as the lone surviving Dodgers player from the 1955 World Series team.“I’ve often thought Carl deserved more credit than he received for his contributions to the success of the Brooklyn Dodgers,” said Peter O’Malley, whose father, Walter, owned the Dodgers from 1950-1979. “He was a calming influence on a team with many superstars and personalities. But getting credit was not Carl and that is what made him beloved.”Erskine received the Buck O’Neil lifetime achievement award in July 2023 by the Baseball Hall of Fame’s board of directors to honor an individual whose efforts enhance baseball’s positive impact on society.“For millions of fans, he was a baseball hero,” Hall of Fame chairman Jane Forbes Clark said in a statement. “For his family and thousands of Special Olympians, Carl was someone who always believed everything was possible. His legacy is one of deep compassion and encouragement of the human spirit.”Carl Daniel Erskine was born Dec. 13, 1926, in Anderson, Indiana. He began playing baseball at age 9 in a local parks program.After graduating high school in 1945, he was drafted into the Navy with World War II underway. A year later, Erskine asked the Navy recreation officer where he was stationed if he could play baseball. He was turned away, but a few weeks later, he was scouted by the Dodgers and discharged from military service.He spent the next 1 1/2 years in the minors before making his major league debut on July 25, 1948. Erskine began as a reliever, going 21-10 during his first two seasons.In 1951, he transitioned to the starting rotation and joined teammates Roy Campanella, Carl Furillo, Gil Hodges, Jackie Robinson and Duke Snider as one of the revered “Boys of Summer.”In 1952, Erskine had a career-best 2.70 ERA and won 14 games. The following year, he led the NL with a .769 winning percentage, along with 187 strikeouts and 16 complete games, all career highs.When teammate Don Newcombe was pitching in the ninth inning of Game 3 of the 1951 NL pennant with the New York Giants, Erskine and Ralph Branca were warming up in the bullpen.On the recommendation of pitching coach Clyde Sukeforth, Newcombe was relieved by Branca, who then gave up the game-winning home run to Bobby Thomson in the famed “Shot Heard ’Round the World.”Whenever Erskine was asked what his best pitch was, he replied, “The curveball I bounced in the Polo Grounds bullpen in 1951.”Nicknamed “Oisk” by fans with their Brooklyn accents, Erskine pitched no-hitters against the Chicago Cubs in 1952 and the New York Giants in 1956.Bobby Morgan preserved Erskine’s no-hitter against the Cubs with two brilliant fielding plays at third base.“I made two super plays on swinging bunts where they just dribbled down the line and I fielded them one-handed and threw to Gil Hodges at first,” Morgan told The Oklahoman newspaper in April 2020.Morgan, who died last year, said Erskine still thanked him years later whenever they spoke.The Dodgers left Brooklyn for Los Angeles in 1957. Erskine started the first home game in Los Angeles on April 18, 1958, when the Dodgers beat the San Francisco Giants 6-5 in front of more than 78,000 fans.However, Erskine didn’t enjoy being away from his family and he lasted just 1 1/2 years in Los Angeles. He pitched his final game in June 1959 and retired at 32.Erskine returned to his hometown about 45 miles northeast of Indianapolis and opened an insurance business. He coached baseball at Anderson College for 12 years, and his 1965 team went 20-5 and won the NAIA World Series.He also became active in the community and served as president and director at Star Financial Bank from 1982-93.A 6-foot bronze statue of Erskine was erected in front of the Carl D. Erskine Rehabilitation and Sports Medicine Center to honor his accomplishments in baseball and as an Anderson resident. An elementary school built on land he donated is named for him. He was inducted into the Indiana National Baseball Hall of Fame in 1979.In 2002, Erskine Street in Brooklyn was named for him.His youngest son, Jimmy, was born with Down syndrome, which led Erskine to champion the cause of people with developmental disabilities. He wrote a book called “The Parallel,” about the similarities Jimmy and Erskine’s teammate Robinson shared in breaking down social perceptions. He was long involved with Special Olympics in Indiana and the Carl and Betty Erskine Society raises money for the organization.“Carl Erskine was an exemplary Dodger,” Stan Kasten, Dodgers president and CEO, said in a statement. “He was as much a hero off the field as he was on the field, which given the brilliance of his pitching is saying quite a lot. His support of the Special Olympics and related causes, inspired by his son Jimmy, who led a life beyond all expectations when he was born with Down syndrome, cemented his legacy.”Jimmy died in November at age 63, outliving his prognosis by decades.Erskine also authored the books “Tales from the Dodger Dugout” and “What I Learned From Jackie Robinson.”He is survived by Betty, his wife of 76 years, and sons Danny and Gary and daughter Susan.",2024-04-17 16:38:00 PM EEST,NBC,"Carl Erskine, Dodgers pitcher and last surviving member of ‘Boys of Summer,’ dies at 97",https://www.nbcnews.com/news/sports/carl-erskine-dodgers-pitcher-last-surviving-member-boys-summer-dies-97-rcna148156
Doha Madani,"College football player Amitral “AJ” Simon died just one week before might have realized his pro ball dreams, his former university announced Wednesday.Simon, 25, transferred to the University of Albany in New York, where he played as a defensive lineman with the Great Danes in 2022 and 2023. The school said in a statement on social media that he will be ""profoundly missed.""""AJ was a tremendous young man and even better teammate throughout this time at UAlbany,"" the school said.""He was a role model both on and off the field, serving as a pillar to this program over the last two years.""A cause of death was not disclosed.Simon was eligible for next week's NFL draft and,  according to NBC Sports , had made a recent visit to New England.  He announced his decision to enter the draft in December after his time on the team ended. He described his collegiate career as a Great Dane as ""pivotal"" in shaping his path to the NFL draft, making him into a better person both on and off the field.""I am thrilled to represent the University of Albany as I take this next step in my football career,"" he wrote. ""Sad that it's over, but grateful that it happened. With that being said, I will be entering my name in the 2024 NFL Draft."" Simon was one of the players  the Coastal Athletic Association named in February  as one of the student-athletes who made the Commissioner’s Academic Honor Roll, which requires students to keep at least a 3.0 grade-point average. On the field, Simon impressed with 12.5 sacks and more than 20 tackles last season,  NBC Sports reported .Albany head coach Greg Gattuso described his two years coaching Simon as ""joyous"" in a  post on X .""My prayers are dedicated to the Simon family,"" Gattuso wrote. ""I love you AJ and will always have a special place in my heart for #8.""",2024-04-18 18:40:00 PM EEST,NBC,NFL prospect AJ Simon dies one week before the draft,https://www.nbcnews.com/news/sports/nfl-prospect-aj-simon-dies-one-week-draft-rcna148392
Mithil Aggarwal,"Google has fired  more than two dozen employees for  protesting  its  $1.2 billion contract  to provide the  Israeli government and military  with cloud and artificial intelligence services.Twenty-eight people were fired after nine employees were arrested Tuesday night following a sit-in at the company’s offices in Seattle, New York and Sunnyvale, California — including one at Google Cloud CEO Thomas Kurian’s office, according to the group that organized the demonstration, No Tech for Apartheid.Protesters sat in his office for more than nine hours, wearing shirts and raising banners that read “No more genocide for profit,” until they were eventually arrested. It is the latest  high-profile clash in the U .S.  stoked by tensions over the  Israel-Hamas war .“These protests were part of a longstanding campaign by a group of organizations and people who largely don’t work at Google,"" a Google spokesperson said in a statement Wednesday. ""A small number of employee protesters entered and disrupted a few of our locations. Physically impeding other employees’ work and preventing them from accessing our facilities is a clear violation of our policies, and completely unacceptable behavior. After refusing multiple requests to leave the premises, law enforcement was engaged to remove them to ensure office safety,"" the statement said. ""We have so far concluded individual investigations that resulted in the termination of employment for 28 employees, and will continue to investigate and take action as needed,"" it added. The protests were led by No Tech for Apartheid, a group of tech workers who have been demanding Amazon and Google drop their Project Nimbus, which is a joint $1.2 billion contract providing the Israeli government and military with cloud infrastructure, artificial intelligence services and data centers.No Tech for Apartheid said that the workers had engaged in a “peaceful sit-in and refusing to leave did not damage property or threaten other workers” and that Google had fired them “indiscriminately.” “This excuse to avoid confronting us and our concerns directly, and attempt to justify its illegal, retaliatory firings, is a lie,” it said in a statement late Wednesday, accusing the company of valuing its contract with the Israeli government more than its employees.Google issued a stern warning to its employees, with the company’s vice president of global security, Chris Rackow, saying, “If you’re one of the few who are tempted to think we’re going to overlook conduct that violates our policies, think again,” according to an internal memo obtained by CNBC.The company also said its work ""is not directed at highly sensitive, classified, or military workloads relevant to weapons or intelligence services.”“Google Cloud supports numerous governments around the world in countries where we operate, including the Israeli government, with our generally available cloud computing services,” a Google spokesperson told CNBC on Wednesday evening.The Israeli prime minister's office and the Israel Defense Forces did not immediately respond to requests for comment from NBC News.The workers were also protesting labor conditions at the company — saying the contract was affecting “health and safety on the job” — and what they said was Google’s disregard “for the well-being of our Palestinian, Arab, and Muslim colleagues  facing  Google-enabled racism, discrimination, harassment, and censorship.”The project has become a “major health & safety workplace conditions issue,” with many employees quitting after having cited “mental health consequences of working at a company that is using their labor to enable a genocide,” the group said in a statement posted Wednesday on  Medium .“On a personal level, I am opposed to Google taking any military contracts — no matter which government they’re with or what exactly the contract is about,” Cheyne Anderson, a Google Cloud software engineer based in Washington, told CNBC on Wednesday.Anderson was one of the nine workers arrested across the country Tuesday, with some of the arrests streamed live on Twitch.Four people were arrested for “trespassing” inside Google’s New York office, a New York police spokesperson told NBC News on Wednesday. Almost 50 protesters had taken part in the demonstration, the spokesperson said.",2024-04-18 14:44:00 PM EEST,NBC,Google fires 28 workers for protesting $1.2 billion Israel contract,https://www.nbcnews.com/news/us-news/google-fires-workers-protest-israel-contract-project-nimbus-rcna148333
