authors,body,datetime,news_site,title,url
Erika Edwards,"Warnings about  fake Botox injections  given by people not trained to give the shots are growing. On Friday, the  New York City Health Department  said that three people have had to go to emergency departments after getting injections of botulinum toxin in their face, neck, upper back or armpits.Within days or weeks of getting the shots, the three developed a range of symptoms, from double vision and drooping eyelids to difficulty swallowing, breathing and raising their arms.Two were hospitalized, and one needed to be admitted to an intensive care unit.  The new insights come as both the Centers for Disease Control and Prevention and the Food and Drug Administration investigate other cases of people who’ve had to be hospitalized with potentially severe side effects after getting fake Botox shots from unlicensed providers.On Friday, the CDC reported that  at least 22 people in 11 states  have had bad reactions,   including slurred speech, trouble breathing and blurry vision, after receiving counterfeit versions of the wrinkle-smoothing treatment. No deaths have been reported. All are women between the ages of 25 and 59, most around age 40. The women had received the shots in “non-healthcare settings,” such as homes and spas, the CDC said. Reports of symptoms possibly related to the fake Botox were first reported in early November 2023.“People should not be getting injections from friends or at parties,” NYC Health Commissioner Dr. Ashwin Vasan said in a  press release  Friday. “A price that is too good to be true, or if a service provider does not explain the risks and side effects of the procedure, are clear warning signs that the products or services may not be legitimate and could pose a risk to your health.”The  FDA  said that there’s no indication that authentic Botox, from the drugmaker AbbVie, is linked to any of the illnesses.The drug uses a purified form of a neurotoxin called botulinum toxin that causes muscle paralysis. Injected in precise amounts into specific areas of the face, it can relax muscles that cause wrinkles.In an email to NBC News, the FDA said that it’s “actively working” with state and federal health authorities to investigate the source of counterfeit Botox.“The question is, is this ‘faux-tox’ all one and the same?” asked Dr. Adam Friedman, a dermatologist and chair of dermatology at George Washington University. “Or are multiple people creating different versions of it? We don’t know the answer to that.”Dr. Kate Dee, a physician and founder of Glow Medispa in Seattle, blamed the recent illnesses on  unregulated medical spas , which have ballooned in recent years, becoming a  $15 billion  wellness industry. “The problem is not that there’s fake Botox around and doctors might accidentally use it. That’s not what’s happening. Doctors get real Botox, and we pay lots of money to do things legally and legitimately,” she said. “It’s these people who are busy trying to make money from the med spa industry, the esthetics industry, who are getting it because it’s so much cheaper.”Cases linked to counterfeit Botox have been detected so far in California, Colorado, Florida, Illinois, Kentucky, Nebraska, New Jersey, New York, Tennessee, Texas and Washington. At least 11 patients have been hospitalized, according to the CDC.Some symptoms, such as blurred vision and drooping eyelids, appeared near the injection site, while others were more widespread, including fatigue and generalized weakness.Other potentially concerning symptoms could include constipation, incontinence, dry mouth and difficulty lifting the head, the FDA said.The difference in side effects from fake BotoxUsually, adverse events related to real Botox injections are the result of “poor technique,” such as injecting the toxin into the wrong muscle or in the wrong location, Friedman said.“But if these patients might be going into respiratory distress or failure because of systemic poisoning,” he said, “that’s different from what doctors usually see.”The FDA said there are several ways to identify counterfeit Botox products:Dee recommends that patients ask to see the vial of toxin before getting the shots. “At the very least, look at the vial because if it’s in any other language besides English, it’s not real Botox.”",2024-04-19 23:45:00 PM EEST,NBC,"Where is the 'faux-tox' coming from? Not from legitimate sources, doctors say",https://www.nbcnews.com/health/health-news/fake-botox-cdc-warnings-symptoms-rcna148197
Erika Edwards,"At least 19 women in nine states reportedly became sick after they got Botox, either having gotten the injections from people who were never licensed or trained to give the shots or received them in ""non-healthcare settings,"" including homes or spas, the  Centers for Disease Control and Prevention said Monday .Nine of the 19 patients were hospitalized, the CDC said. Four ""were treated with botulism antitoxin because of concerns that the botulinum toxin could have spread beyond the injection site.""Botox uses a purified form of a neurotoxin called botulinum toxin that prevents muscles from moving for a period of time. The product is often used to prevent or ease facial wrinkles. When the toxin is found in food, it can lead to widespread paralysis and even death.But when it is injected carefully, botulinum toxin is generally considered safe. Too much in the wrong places can be damaging,  according to the CDC .Cases have been detected in Colorado, Florida, Illinois, Kentucky, Nebraska, New Jersey, New York, Tennessee and Washington. No deaths have been reported.It is unclear whether the reactions were the result of fake products, contamination or poor hygiene practices. The CDC's investigation is ongoing, the agency said.The Food and Drug Administration said in a statement Friday that it was involved with the investigation.Warnings about  medical procedures at unregulated med spas  are rising. Colorado health officials told NBC News that they're investigating a case of botulism-like illness after an unlicensed provider injected a patient with what was allegedly botulinum toxin. The Illinois patients received injections from a nurse ""who was performing work outside her authority,"" according to the state's Public Health Department.Problematic reactions to botulinum toxin injections include:",2024-04-16 04:52:00 AM EEST,NBC,CDC investigating botched Botox shots in 9 states,https://www.nbcnews.com/health/health-news/cdc-investigating-botched-botox-shots-9-states-rcna147947
Aria Bendix,"Health agencies in the U.S. and Europe say there’s no evidence that thoughts of suicide or self-harm are linked to the popular weight loss and diabetes drug semaglutide, which is sold under the brand names Ozempic and Wegovy. After a nine-month review, the  European Medicines Agency concluded  Friday that “the available evidence does not support a causal association” between GLP-1 receptor agonists, the drug class that includes semaglutide, and suicidal thoughts or actions. The  Food and Drug Administration arrived at a similar conclusion  in January. The agency examined reports of suicidal thoughts or actions to its adverse event reporting system, but a  preliminary review  found there wasn’t a clear link to the use of GLP-1 receptor agonists. However, the FDA said in a statement it “cannot definitively rule out that a small risk may exist” and would continue to look into the issue.As  semaglutide rose in popularity  last year, a small number of users  reported suicidal thoughts  while taking it. As of December, the  FDA’s adverse event reporting system  had received 157 reports of suicidal ideation attributed to Ozempic and 18 attributed to Wegovy. By comparison, more than 2.6 million people in the U.S. were prescribed semaglutide from January 2018 to September 2023, according to data provided to NBC News by Epic Research, a health analytics firm.“I don’t think that we can say that the question is completely closed, but the evidence that we have so far is reassuring,” said Dr. Eduardo Grunvald, an obesity medicine physician at UC San Diego Health. He consults for Novo Nordisk, the maker of Ozempic and Wegovy, but  did not speak on behalf of the company. Novo Nordisk told NBC News it “stands behind the safety and efficacy” of its GLP-1 drugs when used correctly and taken under the care of a licensed health care professional. The company said it will continue to monitor reports of adverse reactions, including suicide and suicidal ideation.“We look forward to working with FDA as they complete their review,” the company said in a statement.The FDA approved Wegovy for weight loss in 2021. The agency requires any chronic weight management medicine that works on the central nervous system to carry a warning about suicidal ideation. Wegovy fits that bill, so its prescribing label tells doctors to monitor for depression or suicidal thoughts.Ozempic, a different dosage of semaglutide, does not carry such a warning, since it’s only approved to treat Type 2 diabetes — though some doctors prescribe it off-label for weight loss.Semaglutide was shown in trials to  significantly lower blood sugar levels  and  cut body weight  by an average of 15%.“Overall, clearly, the benefits are winning the race compared to the risks of these drugs,” Grunvald said.A  Nature Medicine study  in January found that people taking semaglutide were  up to 73% less likely to report suicidal thoughts  than people taking other weight loss or diabetes medications. The study analyzed the medical records of nearly 1.6 million patients with Type 2 diabetes and more than 240,000 patients with obesity. One analysis in particular followed two groups, each with around 53,000 patients who had obesity or were overweight but had no history of suicidal thoughts. The first group was prescribed semaglutide, while the second was prescribed anti-obesity drugs that weren’t GLP-1 receptor agonists. After about six months, no one in the semaglutide group had reported a suicide attempt, whereas 14 people in the other group did.The trend was similar for people with a history of suicidal thoughts who were overweight or had obesity, as well as those who were taking semaglutide for Type 2 diabetes.“We saw a lower risk associated with semaglutide compared to other medications, but we don’t know exactly the mechanism yet,” said Rong Xu, the author of the study and a professor of biomedical informatics at Case Western Reserve University.“We’re not saying the risk is zero,” she added. “We just compared to other medications and we didn’t see an increase.”Doctors who regularly prescribe semaglutide say there may be other reasons why patients taking the medication report suicidal thoughts. Among their leading theories: Semaglutide mimics a hormone in the gut that signals to people that they’re full, so they eat less. That might negatively affect people’s moods if they normally use food to cope with depression.“That doesn’t mean that it causes suicidal ideation. It just means that it may dampen your feeling pleasure from certain foods that you’re used to eating to hide your feelings of depression,” said Dr. Caroline Apovian, co-director of the Center for Weight Management and Wellness at Brigham and Women’s Hospital, who sits on Novo Nordisk’s scientific advisory board.Bariatric surgery works similarly in terms of suppressing appetite, Apovian said, and  suicide rates are at least four times higher  among people who have undergone bariatric surgery than among the general population.For the most part, however, doctors say semaglutide improves the health of patients with obesity.“From my clinical experience, people in general overwhelmingly feel much better after they’ve lost this weight,” Grunvald said. “They feel physically better, and they also many times feel emotionally better.”If you or someone you know is in crisis, call 988 to reach the Suicide and Crisis Lifeline. You can also call the network, previously known as the National Suicide Prevention Lifeline, at  800-273-8255 , text HOME to 741741 or visit  SpeakingOfSuicide.com/resources  for additional resources.",2024-04-15 20:25:00 PM EEST,NBC,"Ozempic isn't linked to suicidal thoughts, U.S. and European health agencies find",https://www.nbcnews.com/health/health-news/ozempic-isnt-linked-suicidal-thoughts-us-european-health-agencies-find-rcna147578
Erika Edwards,"Fake Botox is behind 19 reports of vision problems and difficulty breathing and swallowing in at least nine states, the  Food and Drug Administration said Tuesday .The products in question were obtained from  unlicensed sources , and ""may be misbranded, adulterated, counterfeit, contaminated, improperly stored and transported, ineffective and/or unsafe,"" the  agency wrote on its website. ""The sources of these products are unverified and unknown, which is why this situation is certainly concerning,"" said Michelle Waltenburg, senior botulism epidemiologist at the Centers for Disease Control and Prevention. Waltenburg is working with the FDA and state health departments in the investigation.Cases have been detected in Colorado, Florida, Illinois, Kentucky, Nebraska, New Jersey, New York, Tennessee and Washington.There is no indication that authentic Botox, made by the drugmaker AbbVie, is linked to any of the illnesses. That product, the FDA said, ""should be considered safe and effective for its intended and approved uses.""Botox uses a purified form of a neurotoxin called botulinum toxin that paralyses muscles for a period of time. Injected into specific areas of the face, it can relax muscles that cause wrinkles. The concern is that a counterfeit product may spread elsewhere in the body, potentially incapacitating muscles needed to breathe.""Paralysis of respiratory muscles is a very serious consequence,"" Waltenburg said. ""That's why we consider botulism to be both a medical and a public health emergency and encourage people who have symptoms of botulism to seek medical care immediately.""At least 19 women  developed symptoms after they got what they thought was real Botox, either from people who were never trained to give the shots or received them in ""non-healthcare settings,"" including homes or spas, the  CDC said Monday . Almost all sought out the injections for cosmetic reasons. Most were around age 40.Nine of those patients had to be hospitalized. Four were given botulism antitoxin because doctors worried that the toxin could spread throughout the body. While some had difficulty breathing, none of the patients has to be put on a ventilator, Waltenburg said. No deaths have been reported.The CDC is expected to alert physicians nationwide to the issue as early as Wednesday.The FDA said there are several ways to identify counterfeit Botox products:",2024-04-16 20:42:00 PM EEST,NBC,"Fake Botox is the cause of bad reactions in 9 states, FDA says",https://www.nbcnews.com/health/health-news/fake-botox-cause-bad-reactions-9-states-fda-says-rcna148009
Berkeley Lovelace Jr.,"The Food and Drug Administration  said  Tuesday it’s winding down some of its U.S. response to lead-contaminated cinnamon applesauce pouches, which have  sickened hundreds of children  across the country. The FDA will continue to actively investigate how  WanaBana’s apple cinnamon fruit puree pouches , which were recalled in late October because of high lead levels, became contaminated. However, much of the work the agency has done to ensure no one else buys the  applesauce pouches  has ended.The agency has  pulled the product  from stores and prevented any more of it from being imported into the United States.  Two other products made by WanaBana  — Schnucks applesauce pouches with cinnamon and Weis cinnamon applesauce — were also recalled and removed from stores.The WanaBana pouches had been sold at discount retail stores, including Dollar Tree. For several months after the recall, there were  reports of it still being on store shelves .""It would be comforting to see data about how many stores had the products listed as contaminated and to see how they've ensured the removal of those products from store shelves,"" said Laurie Beyranevand, director of the Center for Agriculture and Food Systems at Vermont Law and Graduate School. “These concerns are especially important given the prevalence of those stores being located in communities with lower incomes.""The FDA did not immediately respond to a request for additional comment.The issue will be transferred from the agency’s outbreak response team to its post-investigations unit, where officials will continue to determine exactly how the applesauce pouches became contaminated with lead.The leading hypothesis is that the cinnamon in the applesauce was contaminated with lead. In February, according to the FDA,  Ecuadorian officials identified a cinnamon processor as ""the likely source of contamination."" The processor sourced his cinnamon from Sri Lanka. The Ecuadorian officials said that the cinnamon sticks were lead-free before they were processed, and contaminated after processing. That cinnamon was then sent to a supplier in Ecuador called Negasmart and, in turn, to a facility, Austrofoods, where the applesauce pouches were produced before being exported to the U.S.The FDA will continue to review reports of lead poisoning that are voluntarily submitted to it; however, it says there may not be enough information for follow-up. The FDA’s new focus will largely transition to surveillance and prevention. In March, the agency said it  identified more cinnamon products  sold at discount retail stores that had elevated lead levels.The FDA, along with the Centers for Disease Control and Prevention, had been working with state health officials to track cases of lead poisoning in the U.S. linked to the pouches.Because the applesauce pouches have a long shelf life, agency officials were concerned that they may still have been in people's homes after the recall. As of March, the CDC said that it had received 519 reports of confirmed, suspected and probable cases of lead poisoning linked to the pouches from 44 states. Many young children were among the people sickened. The announcement comes less than a week after FDA Commissioner Dr. Robert Califf  testified before a congressional committee  in part on the agency’s applesauce response.He called on Congress to pass legislation that would require food manufacturers to test for lead in imported foods. Although many food manufacturers do test for harmful chemicals in their products, there is no federal requirement for them to do so.",2024-04-16 20:15:00 PM EEST,NBC,FDA winds down part of lead-contaminated applesauce probe,https://www.nbcnews.com/health/health-news/fda-winds-part-lead-contaminated-applesauce-probe-rcna146589
