authors,body,datetime,news_site,title,url
Matt Dixon,"Donald Trump  emerged from a Manhattan courtroom Monday ready for a fight.After day one of a trial that has Trump  facing 34 counts  of falsifying business records related to hush money payments to a porn star, the former president stood in front of reporters ready to unleash a grievance-laced tirade that, at times, did not totally reflect reality but guaranteed he would continue to dominate the headlines even from court.His immediate focus was Judge Juan Merchan’s decision to not yet rule on whether Trump can attend his son Barron’s May 17 high school graduation. Merchan did not say Trump could not go, but rather he was not yet ready to rule on the matter. Specifics aside, however, it gave Trump just enough to paint the picture for his supporters of a biased judge blocking a loving father from seeing his son’s graduation.“My son is graduating high school, and it looks like the judge will not let me go to the graduation,” Trump told the assembled group of reporters.It’s emblematic of how Trump has tried to control the narrative — an instinct that has defined his political career — even while stuck in a camera-less Manhattan courtroom. The judge has ordered Trump to attend court hearings in person, so it’s a predicament he will find himself in at least four days a week for the foreseeable future as President Joe Biden continues to run a more traditional presidential campaign. The false claim a judge was not allowing him to attend his son’s graduation spread like wildfire in the conservative ecosystem, a conflagration helped by some of his top supporters with huge followings. Kari Lake called Merchan “ heartless & cruel. ” Piers Morgan used a  New York Post column  to call the-decision-that-was-not “disgusting.” Donald Trump Jr. called it “ pure evil .” For millions of Trump supporters, the half-truth became the truth and a cause celebre for those eagerly looking to maintain the belief that the entire legal fight is an attempt by Democrats to get Trump locked up.Those sorts of distortions and fights about nearly every aspect of the trial dominated the first week, which focused on jury selection. It was often reality versus Trump’s version of it.There were reports Trump may have  fall en  asleep  in court, where cameras are not allowed in these types of cases. He responded forcefully on Truth Social that “I was PRAYING not sleeping!!!”Trump had a misunderstanding about the jury selection process. It led him to post on Truth Social that the process is another example of “ ELECTION INTERFERENCE! ” And Trump has broadly used a torrent of Truth Social posts and media interviews to paint a picture of both Merchan and Manhattan District Attorney Alvin Bragg as biased and out to get him, a sentiment that has been taken as gospel and amplified by conservative media.In fundraising text messages, Trump has also told supporters that he left the courtroom, which at no point during the week happened except during scheduled court recesses or when court was over for the day.“I JUST STORMED OUT OF COURT!” read a fundraising text message from Trump’s campaign. “They think I’m finished, but I’LL NEVER SURRENDER!”Trump also tried to raise political cash off the claim that he has been blocked from attending Barron’s graduation.“THEY ARE FORCING ME TO SKIP MY SON’S GRADUATION,” Trump’s campaign texted. “I’LL BE IN COURT.”“Heartless thugs,” it continued.The trial-focused fundraising efforts have been breaking through the noise. On the first day of trial, Trump's campaign raised $1.6 million in small-dollar donations, a campaign official told NBC News. Trump raised that much online on only three days in the first three months of 2024, according to a recent campaign finance filing from WinRed, the Trump campaign's online donation platform. Each of those three days came toward the end of March.""Crooked Joe Biden and the Democrat's entire strategy to defeat President Trump is to confine him to a courtroom and unconstitutionally silence him throughout this sham Biden trial,"" said Trump spokesperson Karoline Leavitt. ""Polling shows the American people see right through the Stalinist tactics employed by Crooked Joe and his allies.""""President Trump and his team will continue fighting for truth in the courtroom, while working to earn votes on the campaign trail,"" she added.Much of the nation’s attention is focused on the historic nature of an ex-president on trial, a saturation that has helped Trump continue his unmatched ability to get and retain attention regardless of the specific situation — which, in this case, is being stuck in court facing unflattering revelations about his personal life and accusations about trying to hide the information to get elected. “I don’t think any of it matters. He totally rewrote the rules,” said a longtime Republican operative granted anonymity to speak freely about Trump’s week-one performance. “There are between 75-80 million people who will vote for him because he is a scrappy fighter. Working class folks see him as a billionaire bubba.”The entire episode sets up a split screen of a former president mired in legal fights and stuck in court and an incumbent president checking all the boxes of what would be considered a traditional presidential campaign. Biden has a significant fundraising advantage and continues to hold in person campaign rallies, most recently a swing through Pennsylvania, including events in  his hometown  of Scranton, where he attacked Trump on a range of issues — but noticeably did not mention his legal woes. Biden's campaign  has previously said  it would avoid directly taking shots at Trump's legal problems to try and avoid the perception of a weaponized Justice Department. Beyond fundraising text messages, Trump’s political operation has continued to work in the background. On Wednesday — the trial’s off day — Trump had dinner with Polish President Andrzej Duda at Trump Tower in New York, and on Saturday, he is set to hold a rally in North Carolina, a  key swing state.Trump has also  installed top allies  to lead the Republican National Committee, which has generally been focused on the more basic types of political blocking-and-tackling as the presidential nominee is likely to be stuck in courtrooms for most of the 2024 election cycle. Including the current trial, Trump faces four separate criminal indictments and a handful of civil lawsuits, some of which will  continue to play out through November. ""We are getting a lot of data being shared with us to help us register and engage voters,"" an RNC member said. Trump has also used post-trial campaign stops to attract attention, including a Tuesday visit to a New York bodega. Trump at times tried to use the stop to focus on the rising cost of consumer goods and crime, which have been two policy themes of his presidential campaign, but the focus inevitably turned to his trial.Trump was asked what he thought about the seven jurors who had been selected as of Wednesday —  the full 12-member jury  was chosen Thursday — and he was blunt that the outcome would drive his assessment. “I’ll let you know in about two months,” Trump said of the trial’s likely timeline.",2024-04-19 12:00:00 PM EEST,NBC,Twisted truths and a fundraising boost: How Trump tried to control his first week in court,https://www.nbcnews.com/politics/donald-trump/twisted-truths-fundraising-boost-trump-control-first-week-court-rcna148054
Rebecca Shabad,"All 12 jurors, plus an alternate, were selected this week to serve on the jury in former President Donald Trump’s  hush money trial  in New York after they made it clear to both sides that they could render a fair and impartial verdict.Prosecutors and the defense team  whittled down a pool of nearly 200 people to 12 jurors and an alternate after grilling them on their personal history, political views, social media posts, and ability to remain impartial despite any opinions they might have about the polarizing former president.Seven people were sworn in Tuesday but two of them ended up being removed on Thursday for possible conflicts. Later Thursday, the remaining seven jurors were sworn in, plus one alternate.The trial is expected to last as long as eight weeks.",2024-04-17 23:52:00 PM EEST,NBC,"A lawyer, a banker and a speech therapist: Meet the 12 jury members of Trump’s hush money trial",https://www.nbcnews.com/politics/donald-trump/meet-the-first-7-jury-members-as-trumps-hush-money-trial-progresses-rcna148198
Ryan J. Reilly,"WASHINGTON — Three California men who were associated with the ""Three Percenter"" militia group and convicted in connection with the Jan. 6 Capitol attack were taken into custody Friday after a judge ordered them to serve sentences ranging from 21 to 33 months in federal prison, far below what the government had requested.Erik Scott Warner, Felipe Antonio Martinez, Derek Kinnison and Ronald Mele were all  found guilty  of felony obstruction of an official proceeding and other charges after a trial last year. One of their co-defendants, former California police chief Alan Hostetter, was  sentenced to more than 11 years in federal prison  in December. The trials featured testimony from co-defendant  Russell Taylor , who pleaded guilty as part of a plea deal with the government.The felony charge they were convicted of — obstruction of an official proceeding —  is currently before the Supreme Court , where some of the justices seemed skeptical of the way the government had used the charge. A decision in that case is expected in the coming months. If the Supreme Court guts the charge, two of the defendants could end up only serving 12 months in prison on their misdemeanor convictions.The men communicated over a ""The California Patriots — DC Brigade"" Telegram chat and brought weapons on their trip to Washington to participate in Jan. 6, according to evidence shown at trial. They kept a shotgun in their car, and Kinnison and Mele claimed they stored five handguns in their hotel room ""despite understanding that it was illegal,"" the government said. “We’re packing light just a scatter gun and a pistol a piece,"" Martinez joked, according to prosecutors.Prosecutors had sought lengthy sentences for the foursome between 6.5 and eight years in federal prison, but Judge  Royce Lamberth  landed on much lower sentences within the guidelines range.Warner received 27 months after telling Lamberth that he ""got caught up"" in the mob and was sorry for his conduct. ""I shouldn't have been there,"" he said, apologizing to his family for putting them ""through hell.""Martinez received 21 months in prison after he said he was ""very sorry"" and apologized for his conduct, telling Lamberth that he would ""never see me back here.""Kinnison was sentenced to 33 months in prison. He spoke about his love of God, family and country and said he admired the ""Judeo-Christian principles that the country was founded upon."" He said that he did repent for his sins and ask forgiveness for his sins and that he was praying for Lamberth and the prosecutors on the case. Mele was also sentenced to 33 months. Prosecutors said he ""awarded"" his co-conspirators a ""Capitol Action Badge"" a few weeks after Jan. 6, which prosecutors described as a ""crudely modified version of a real military reward."" He said Jan. 6 ""gave this country a black eye"" that was still tender. Mele said he had pulled himself away from politics and that the experience of going through trial and seeing videos of some of the horrific violence at the Capitol had ""opened my eyes."" He said that he didn't condone what happened, calling it ""asinine.""The government had sought eight years in prison for all the defendants except for Martinez, who they said should serve six and a half years.The stakes, Assistant U.S. Attorney Anthony Mariano argued, could not be much higher, and the defendants here were in a “rare class” of Jan. 6 defendants who “worked together and had a plan” and were convicted in a criminal conspiracy. They came to Washington with “everything a soldier going into battle needs,” he noted.""We are 262 days away from Jan. 6, 2025,"" Mariano said Friday, arguing that the sentence imposed ""needs to consider January 6, 2025, 2029, 2033, and so on.""More than 1,387 people have been charged in connection with the Capitol attack, with more than 984 defendants having been convicted. Of the more than 859 defendants who have been sentenced, more than 520 have been sentenced to periods of incarceration of a few days behind bars to  22 years in federal prison .The overwhelming majority of Jan. 6 defendants in custody either admitted to their criminal conduct or were found guilty at trial; only about  15 defendants in pretrial custody .",2024-04-20 00:35:00 AM EEST,NBC,Judge locks up 'Three Percenter' militia members in Jan. 6 obstruction case,https://www.nbcnews.com/politics/justice-department/judge-locks-three-percenter-militia-members-jan-6-obstruction-case-rcna148456
The Associated Press,"The Sheetz convenience store chain has been hit with a lawsuit by federal officials who allege the company discriminated against minority job applicants.Sheetz Inc., which operates more than 700 stores in six states, discriminated against Black, Native American and multiracial job seekers by automatically weeding out applicants whom the company deemed to have failed a criminal background check, according to U.S. officials.President Joe Biden stopped by a Sheetz for snacks this week while campaigning in Pennsylvania.The Equal Employment Opportunity Commission filed suit in Baltimore against Altoona, Pennsylvania-based Sheetz and two subsidary companies, alleging the chain’s longstanding hiring practices have a disproportionate impact on minority applicants and thus run afoul of federal civil rights law.Sheetz said Thursday that it “does not tolerate discrimination of any kind.”“Diversity and inclusion are essential parts of who we are. We take these allegations seriously. We have attempted to work with the EEOC for nearly eight years to find common ground and resolve this dispute,” company spokesperson Nick Ruffner said in a statement.The privately held, family-run company has more than 23,000 employees and operates convenience stores and gas stations in Pennsylvania, West Virginia, Virginia, Maryland, Ohio and North Carolina.The lawsuit was filed in federal court on Wednesday, the day Biden stopped at a Sheetz market on  a western Pennsylvania campaign swing , buying snacks, posing for photos and chatting up patrons and employees.Federal officials said they do not allege Sheetz was motivated by racial animus, but take issue with the way the chain uses criminal background checks to screen job seekers. The company was sued under Title VII of the Civil Rights Act of 1964, which prohibits workplace discrimination on the basis of race, sex, religion and national origin.“Federal law mandates that employment practices causing a disparate impact because of race or other protected classifications must be shown by the employer to be necessary to ensure the safe and efficient performance of the particular jobs at issue,” EEOC attorney Debra M. Lawrence said in a statement.“Even when such necessity is proven, the practice remains unlawful if there is an alternative practice available that is comparably effective in achieving the employer’s goals but causes less discriminatory effect,” Lawrence said.It wasn’t immediately clear how many job applicants have been affected, but the agency said Sheetz’s unlawful hiring practices date to at least 2015.The EEOC, an independent agency that enforces federal laws against workplace discrimination, is seeking to force Sheetz to offer jobs to applicants who were unlawfully denied employment and to provide back pay, retroactive seniority and other benefits.The EEOC began its probe of the convenience store chain after two job applicants filed complaints alleging employment discrimination.The agency found that Black job applicants were deemed to have failed the company’s criminal history screening and were denied employment at a rate of 14.5%, while multiracial job seekers were turned away 13.5% of the time and Native Americans were denied at a rate of 13%.By contrast, fewer than 8% of white applicants were refused employment because of a failed criminal background check, the EEOC’s lawsuit said.The EEOC notified Sheetz in 2022 that it was likely violating civil rights law, but the agency said its efforts to mediate a settlement failed, prompting this week’s lawsuit.For more from NBC BLK,  sign up for our weekly newsletter .",2024-04-19 19:59:00 PM EEST,NBC,Convenience store chain with hundreds of outlets in 6 states hit with discrimination lawsuit,https://www.nbcnews.com/news/nbcblk/sheetz-convenience-store-chain-discrimination-lawsuit-eeoc-rcna148567
The Politics Desk,"Welcome to the online version of  From the Politics Desk , an evening newsletter that brings you the NBC News Politics team’s latest reporting and analysis from the campaign trail, the White House and Capitol Hill.In today’s edition, senior legal correspondent Laura Jarrett explains how Donald Trump has already hobbled his legal team one week into his criminal trial. Plus, ""Meet the Press"" moderator Kristen Welker breaks down how foreign affairs has defined Joe Biden's presidency.Sign up to receive this newsletter in your inbox every weekday here.<h2>How Trump has hobbled his legal team before the first witness is even called at his historic trial</h2>For the better part of the last year, former President Donald Trump has sought to turn what would ordinarily amount to significant legal trouble into a political asset. Four indictments and one mugshot later, he’s successfully managed to dodge any dip among his supporters. Yet now that he stepped into a no-frills Manhattan courtroom this week for the start of his first criminal trial, the legal downside of his political strategy has come into sharp view.Do you have a news tip?  Let us know The rules of criminal procedure don’t change, no matter the defendant, even for a former president. And the courtesies and customs recognized between seasoned prosecutors and defense lawyers begin to break down, if not completely collapse. In a telling moment near the end of a long day in court Thursday, Trump’s lead attorney, Todd Blanche, asked if he could get the names of the first three witnesses the prosecution intends to call. That’s a routine and reasonable request. But the prosecutor, Joshua Steinglass, rebuffed him. Why? Because “Mr. Trump has been tweeting about the witnesses,” Steinglass said. “We’re not telling them who the witnesses are. I’m sorry.” Judge Juan Merchan, who has been the subject of his own wave of attacks from the presumptive Republican presidential nominee, then said: “I can’t fault the People for that.” The issue came up again late Friday afternoon, and the prosecution agreed to turn over the name of the first witness to the defense on Sunday. But the implication remains: Trump’s legal team is facing a distinct strategic disadvantage with less time to plan cross-examinations of the state’s witnesses. In other words, instead of being able to focus all weekend on prioritizing the expected testimony of just a few witnesses, all are up for grabs. And it’s all because Trump has been railing against multiple witnesses online, and has only ramped up his vitriol in recent days, notwithstanding a court order directing him not to do so.This is the year the legal and political lives of Trump have been on a collision course. The only difference is, now the side that’s feeling the burn is his own team.<h2>Trump trial latest: Jury selection completed during a tense day inside and outside the courtroom</h2>Opening statements are set to begin next week in  Trump’s criminal trial  after the final members of the jury were seated Friday, following a dramatic day in which two prospective jurors broke down in tears, an appeals court judge rejected the former president’s request for a stay, and a man  set himself on fire  in front of the New York City courthouse.“We’re going to have opening statements on Monday morning. This trial is starting,” Merchan said towards the end of the day, after successfully seating the remaining five alternate jurors that were needed.The case — the first-ever criminal trial of a former president — will be heard by a panel of 12 jurors and a total of six alternates. It’s expected to last roughly six weeks.The five alternates ultimately selected Friday include an unemployed married woman who’s into art and described herself as not political, an audio professional, a contract specialist, a clothing company executive and a construction company project manager. It took four days of jury selection to find the 18 jurors.Around the same time the judge declared “we have our full panel” inside the courtroom in the early afternoon, a man set himself on fire outside the courthouse. A spokesperson for the NYPD said the man was in critical condition. He appears to have had pamphlets describing a conspiracy involving cryptocurrency that he threw around before setting himself ablaze, police said.Read more from the fourth day of the Trump trial here →<h2>A pivotal moment for Biden, Ukraine and Congress</h2>A pivotal moment has arrived for President Joe Biden, Ukrainian President Volodymyr Zelenskyy and House Speaker Mike Johnson. Can the GOP-led House pass the aid Ukraine says it needs in its two-year-old war against Russia? If it does, is it already too late to help? How much longer does Ukraine need assistance? And how much is riding on the outcome of the 2024 election, given Trump’s past opposition to this aid?  These are among the questions that I plan to ask Zelenskyy on Sunday when I interview him on “Meet the Press.”The congressional fight for Ukraine aid has also underscored an important point about the Biden presidency: It’s been largely defined — and unsettled — by events overseas. It began with the botched  and deadly  U.S. withdrawal from Afghanistan in August 2021.Then there was Russia’s invasion of Ukraine on Feb. 24, 2022.And then came the Oct. 7, 2023, Hamas attack in Israel, which has led to a six-month war. Just in the past week, we saw Iran  launch  missile strikes and drones at Israel, while Israel  responded  Thursday night by carrying out what appears to be a limited response inside Iran.“We don’t want to see this escalate. ... We’re not looking for a wider war with Iran. ... I think, you know, the coming hours and days will tell us a lot,” National Security Council spokesman John Kirby  told me last Sunday . How foreign affairs has defined Biden’s presidency has carried over with Russia’s invasion of Ukraine — and with the current congressional drama over whether the U.S. will continue to provide Ukraine with the funding it needs.All of it creates a fraught backdrop as the 2024 race heats up.That’s all from The Politics Desk for now. If you have feedback — likes or dislikes — email us at  politicsnewsletter@nbcuni.comAnd if you’re a fan, please share with everyone and anyone. They can sign up  here . ",2024-04-20 00:30:00 AM EEST,NBC,The legal downside to Trump’s very political trial strategy: From the Politics Desk,https://www.nbcnews.com/politics/trump-trial-legal-strategy-politics-desk-rcna148629
