authors,body,datetime,news_site,title,url
Arturo Conde,"Fans will recognize him from the reboot of “Magnum P.I.,” a crime action TV series about a former Navy SEAL who solves cases in Hawaii. Starting Friday, actor Jay Hernandez can be seen on the big screen in  “The Long Game,”  an underdog sports movie about a Mexican American golf team who wins the Texas high school championship in 1957.In the film also starring Dennis Quaid and Cheech Marin, Hernandez plays J.B. Peña, a Mexican American war veteran and school district superintendent who's rejected from membership at the San Felipe Country Club in Del Rio, Texas, because of his ethnicity, but who goes on to form a high school golf team, the Mustangs, for the Mexican American teens who fell in love with the sport while caddying at the club.  The Mexican American golf team  went on to win the high school championship .“For my character particularly, he feels that's (the golf club) his destination of acceptance. ... It’s an aspirational thing for him,” Hernandez said in an interview. “He served in the military, that wasn’t enough. He’s essentially living the American dream, that’s still not enough,” Hernandez said about Peña. “He just feels like there’s this moving goal post.”“The Long Game,” directed by Julio Quintana and adapted from Humberto G. Garcia’s novel “Mustang Miracle,” tells the  true story of the five Mexican American golfers  from San Felipe High School who became state champions in spite of segregation. “Mexican Americans in the 1950s occupied no better stature in American society than did African Americans,” Garcia wrote in the book. “We were not allowed in many restaurants, hotels, and other service establishments. In fact, we were not even allowed to enter the many buildings we helped build. Mexican Americans were certainly not allowed to join country clubs and partake of the game of golf as members.”Hernandez, who's also one of the executive producers of “The Long Game,” said the story is important because it shows viewers that there are many types of Americans.""We’re American and the American story is also an immigrant story. It’s also a Mexican American story. It’s also a Puerto Rican story. It’s also a Chinese American story. That’s the beauty of this country,"" he said. Off camera, Hernandez, who was born in Los Angeles, says identity is something he is trying to understand.“I have obviously a natural affinity to the United States. I love this country. I grew up with my dad flying the American flag on our porch since I was a young kid,” he said.But, he added, part of his family’s cultural background — specifically on his father’s side — is also from Mexico. And this has shaped his roles in front of the camera.‘They don’t get the acknowledgment’  “I played cops and soldiers and done so many of those types of characters. My personal connection is that my grandfather served in World War II. And he was probably one of those people whose stories don’t really get told,” Hernandez said. “They don’t get the acknowledgment that they deserve in terms of Mexican Americans serving the armed forces.”Putting a spotlight on those overlooked stories motivated Hernandez to work on this movie.“It’s not always border stories and criminals. There’s a whole other world of stories that need to be told, be it astronauts, or golfers, or just people transcending their environment,” he said.Ultimately, Hernandez said, “The Long Game” is a story about trying to fit in.He described a scene from the movie where the young golfers go to Mexico. As Mexican Americans they’re not recognized there as full Mexicans. But in the U.S., they are not seen as full Americans either.""They’re not accepted as full people,"" Hernandez said. ""They’re the other in the story.""For more from NBC Latino,  sign up for our weekly newsletter .",2024-04-12 12:30:00 PM EEST,NBC,Racism kept these Mexican Americans from a Texas golf club. They won the state championship anyway.,https://www.nbcnews.com/news/latino/-long-game-story-texas-mexican-american-high-school-golf-team-victory-rcna147348
Daysia Tolentino,"Raquel Lee Bolleau, who shared her experiences working on “The Amanda Show” as a child actor in “Quiet on Set,” said she is “done” with the entertainment industry after her recent experience with the docuseries.In a TikTok video posted Wednesday, Bolleau expressed her frustration with  the Investigation Discovery series , which featured interviews with several actors and former child stars who alleged abuse, inappropriate behavior and a toxic work environment when they appeared on some Nickelodeon shows Dan Schneider produced in the 2000s and the 2010s. Following the docuseries' release last month, Schneider  apologized  for some of his past behavior and the on-set atmosphere.Bolleau said the “Quiet on Set” producers did not invite her to join a panel discussion with other former Nickelodeon stars for the show’s fifth episode, which aired Sunday. Representatives for Bolleau and Investigation Discovery did not immediately respond to requests for comment. Maxine Productions, which produced “Quiet on Set,” and its parent company, Sony Pictures Entertainment, also did not immediately respond to requests for comment. The “Quiet on Set” producers “did the same thing that the industry always does,” Bolleau says in the video, which had amassed over 300,000 views as of Thursday afternoon. “They get what they want from you and then they’re done.”Journalist Soledad O’Brien interviewed the actors who appeared in the episode. She asked them about various issues that were brought up in the docuseries, as well as their thoughts about what the entertainment industry can improve on.  While Bolleau was not part of the group that was interviewed, the final episode included a previously unaired clip of her  describing an alleged incident  on set of “The Amanda Show."" She said she was ""infuriated"" after she was repeatedly spit on by Amanda Bynes during a sketch. She said she was told to ""keep your cool"" and try not to make the incident a problem.A spokesperson for Bynes declined to comment on Thursday.O’Brien showed the clip of Bolleau to “All That” actor Bryan Hearne and his mother, Tracey Brown, during a discussion about racism and representation on set. Hearne said that he was unaware of the incident Bolleau recounted and that he had had only “one solid conversation” with her. However, he said, hearing Bolleau’s experience “hit me really hard.” His mother, Brown, called the incident ""racist.""In his response to the docuseries’ release, Schneider said that “diversity has always been very important” to him.Hearne and Brown did not immediately respond to requests for comment. Bolleau said producers informed her that the clip of her would be shown Sunday, the day the episode dropped. She said she wished she had been able to be part of the discussion with others.“You want me to share my story, but you don’t want to involve me in the actual narrative of change,” Bolleau said. She also claimed that the documentary’s producers did not tell her the premise of the series when they reached out to her. “First of all, you don’t even tell me what type of documentary that I’m going to be a part of,” she said. “You never questioned whether or not this is going to be triggering for me.”It has been “very, very difficult” for Bolleau to face the traumatic experiences that happened to her when she was a young actor, she said. “I can’t do it anymore,” she said at the end of the TikTok video. “I’ve given it all I can. I don’t have nothing else. The show, I don’t want to talk about it. I’m going to get back to my family, my businesses; that’s what I’m focused on. Because this industry? Y’all can have it.”  She posted the video days after former “Double Dare” host Marc Summers also said  he was misled  about the docuseries’ premise. Summers  appeared on Elvis Duran’s program “The Elvis Duran Show”  to promote his off-Broadway show “The Life and Slimes of Marc Summers,” which tells his life story, including his time at Nickelodeon.In the interview, Summers said the docuseries producers “did a bait and switch” on him. “They ambushed me,” he said. “They never told me what this documentary was really about.”Summers said he left the “Quiet on Set” interview after producers showed him a video and explained the premise of the series. It was not clear from the interview or from the docuseries what clip he was shown.Mary Robertson and Emma Schwartz, who directed the series, previously responded to Summers' comments in a joint statement provided by Investigation Discovery. “We are clear with each participant about the nature of our projects,"" they said.",2024-04-12 01:42:00 AM EEST,NBC,Former Nickelodeon star featured in 'Quiet on Set' says she's 'done' with the entertainment industry,https://www.nbcnews.com/pop-culture/pop-culture-news/raquel-lee-bolleau-quiet-on-set-docuseries-response-rcna147404
Minyvonne Burke,"""The Golden Bachelor"" Gerry Turner and his wife, Theresa Nist, announced Friday they are divorcing three months after their televised wedding.""Theresa and I have had a number of heart-to-heart conversations and we've looked closely at our situation, our living situation and so forth and we've kind of come to the conclusion, mutually, that it's probably time for us to dissolve our marriage,"" Turner, 72, said on "" Good Morning America ."" The pair tied the knot in a televised ceremony in January after meeting last fall on the first season of ""The Golden Bachelor,"" a spinoff of the long-running ABC dating reality show ""The Bachelor."" Nist, 70, thanked fans for their support. ""I don’t think we can tell you how many people told us that it gave them so much hope,"" she said. ""We want none of that to change for anybody.""Turner and Nist did not say what led up to their split but suggested they had trouble deciding where to live. Nist is a  financial services professional from New Jersey  and Turner is a retired restaurateur from Indiana. The pair told ABC News' Juju Chang in November that they had planned to live in South Carolina.""We looked at homes in South Carolina, we considered New Jersey, and we just looked at homes after home,"" Nist said. ""But we never got to the point where we made that decision.""Turner and Nist captured hearts during the first season of ""The Golden Bachelor,"" in which seniors were given the chance to find love. Turner was in search of a romantic partner following the death of his high school sweetheart, Toni, in 2017. Although their marriage was short-lived, Turner and Nist said they still love each other. ""There’s no doubt in my mind, I still am in love with her,"" he said. ""I root for her every day.""""Yeah, I still love him,"" Nist added. ",2024-04-12 15:29:00 PM EEST,NBC,'The Golden Bachelor' Gerry Turner and Theresa Nist announce divorce 3 months after getting married,https://www.nbcnews.com/pop-culture/pop-culture-news/-golden-bachelor-gerry-turner-theresa-nist-announce-divorce-3-months-g-rcna147535
Nicole Acevedo,"Hits by two late Latin music icons whose ballads and salsa songs are constants in playlists across generations have been inducted into the National Recording Registry at the Library of Congress.Juan Gabriel's ""Amor Eterno"" (""Eternal Love"") and Héctor Lavoe's ""El Cantante"" (""The Singer"") are among the  25 recordings and albums selected Tuesday  for preservation at the nation’s audio history library.Released in 1990, Gabriel wrote the heart-rending ballad ""Amor Eterno"" in memory of his deceased mother. The song has since become a staple for many Latino families, touching the hearts of one and all — young, old, working class, upper class, urban and rural.Regarded as “El Divo de Juárez,” Gabriel began his career in Mexico in the 1970s and rose to stardom in the 1990s.  He died in 2016 at age 66 .The iconic Mexican singing-songwriting superstar is known for his fierce and forceful delivery, making audiences want to sing every one of his songs from the top of their lungs, as well as his sweet voice effectively pulling at everyone's heartstrings.For many in LGBTQ communities , Gabriel's flashy onstage personality and exuberant sense of style helped break down social norms, strict gender roles and machismo.  Iván Gabriel Aguilera, the singer's son, said his father always wanted future generations to relate to his music.""He would always say that 'as long as the public, the people, keep singing my music, Juan Gabriel will never die,'"" Aguilera said in Spanish. ""It’s nice to see that is happening here.""""He’s going to be immortalized there in the Library of Congress,"" Aguilera added.As Gabriel was jumpstarting his career in Mexico in the 1970s, Lavoe  had established himself as one of the greatest salsa music performers in New York City, later becoming known by salsa lovers everywhere as one of the genre's greats. Released in 1978, ""El Cantante"" not only became Lavoe's signature song: It also became emblematic of the new era of salsa music being ushered in by Fania Records.Written and produced by fellow Fania Records alums and salsa icons Rubén Blades and Willie Colón, “El Cantante” narrates the livelihood, struggles and adversities singers face. It also describes how they must interact positively with the audience when oftentimes they are their only supporters.Born in Puerto Rico and raised in the mainland U.S., Lavoe worked as a singer and trombonist with fellow  Fania Records great Johnny Pacheco  and his orchestra. He joined forces with Colón in 1966, creating one of the most important salsa bands that helped reshape the Latin music industry at the time. One of their hits, “Mi Gente” (“My People”), written by Pacheco, is regarded today by many Latinos as an anthem of Hispanic pride.Lavoe died in 1993 at age 46.Both ""Amor Eterno"" and ""El Cantante"" are among the dozens of Latin songs nominated to be added to the registry by Rep. Joaquin Castro, D-Texas, and the Congressional Hispanic Caucus as part of a larger effort to increase the recognition of Latino contributions to American history and culture.Every year for the past 18 years, the Library of Congress has selected 25 recordings for preservation at the National Recording Registry, with  works by Latino musicians  currently representing less than 5% of inducted titles, according to Castro's office.Castro has received hundreds of suggestions from the public for congressional nominations to the National Recording Registry over the past two years, submitting nearly 70 titles of Latin songs for consideration, including Gabriel’s “Amor Eterno” and Lavoe’s “El Cantante” as well as Irene Cara’s “Flashdance…What a Feeling” and Daddy Yankee’s “Gasolina,”  which were inducted last year .All of these songs have helped bring the number of titles on the registry to 650, representing a small portion of the national library’s vast recorded sound collection of nearly 4 million items, according to the Library of Congress.For more from NBC Latino,  sign up for our weekly newsletter .",2024-04-16 20:30:00 PM EEST,NBC,Hits by Latin music greats Juan Gabriel and Héctor Lavoe added to National Recording Registry,https://www.nbcnews.com/news/latino/juan-gabriel-hector-lavoe-national-recording-registry-cantante-eterno-rcna147991
Kalhan Rosenblatt,"The first weekend of the iconic Coachella Valley Music and Arts Festival in Indio, California, has concluded — but social media is still buzzing about all the event’s highs and lows. From a much-hyped No Doubt reunion to Taylor Swift and Travis Kelce sightings, the influencer-filled festival was full of moments that made headlines.Here’s what you might have missed.No Doubt reunites with a surprise guestIt's been  roughly  nine  years  since the members of No Doubt, led by Gwen Stefani, performed together. But the quartet reunited in the  desert for an electric, nostalgic set.“I didn’t think this was really going to happen,” Stefani told the crowd at one point, according to social media footage posted by users. “Did you?”During the song “Bathwater,” singer Olivia Rodrigo surprised the crowd by joining the band onstage.Blur was a bustDamon Albarn, best known for his band Gorillaz, performed at Coachella with his band Blur — but was met with a lukewarm reception, according to reports and social media footage from the event. Some songs, in which Albarn attempted to get the crowd to sing along, were met with silence from the audience. At one point Albarn told the crowd that they should sing along because “you’ll never see us again.”Swift and Kelce  dance  in the desert Typically, Swift is singing on the world’s biggest stage while her boyfriend, Kelce, is on the field playing for the Kansas City Chiefs. But at Coachella, the couple were spotted  in the crowd , singing along and dancing as they watched the set for Bleachers, the band of Swift’s frequent collaborator Jack Antonoff. They were also seen enjoying a performance from rapper Ice Spice, whom Swift featured on her song “Karma.”Fans shared pictures of them all weekend on social media.Grimes apologizes for a disastrous setDuring her set, Grimes experienced significant technical malfunctions. While the first part of her set appeared to go as planned, the second half was riddled with issues, eventually leading Grimes to scream into the microphone in frustration. She later posted on X , apologizing for the mishap and saying that her set for weekend two will be “flawless.”Kesha changes the lyrics of 'TiK ToK'Kesha made a guest appearance during Reneé Rapp’s set. While the pair performed Kesha’s “TiK ToK,” the singer changed the opening lyrics from “Wake up in the morning feeling like P. Diddy” to “Wake up in the morning like, ‘F--- P. Diddy.’” Both Rapp and Kesha held up their middle fingers during the line. Since November,  Sean “Diddy” Combs  has been hit with five lawsuits in New York accusing him of sexual assault, sexual trafficking and engaging in other criminal activity. Combs has denied all of the allegations, calling them sickening.Coach-EARLE-aIt wouldn’t be Coachella without influencers abound.The soda brand Poppi leaned in by tapping the TikTok “It Girl” Alix Earle. She and some friends stayed in the “Poppi house” at Coachella.Earle posted several photos  and videos about the festival, which have racked up millions of views.",2024-04-15 23:30:00 PM EEST,NBC,"Coachella weekend 1: No Doubt reunites, Blur flops and influencers influence",https://www.nbcnews.com/pop-culture/pop-culture-news/coachella-weekend-1-recap-no-doubt-taylor-swift-travis-kelce-kesha-rcna147829
The Associated Press,"The artist and curators representing Israel at this year’s Venice Biennale announced Tuesday they won’t open the Israeli pavilion exhibition until there is a  cease-fire in Gaza and an agreement to release hostages .Their decision was posted on a sign in the window of the Israeli national pavilion on the first day of media previews, just days before the Biennale contemporary art fair opens Saturday.Israel is among 88 national participants in the 60th Venice Biennale, which runs from April 20-Nov. 24. The exhibition in the Israeli national pavilion had been titled “Motherland” by artist Ruth Patir.There was no immediate comment from Biennale organizers.Even before the preview, thousands of artists, curators and critics had signed an open letter calling on the Biennale to exclude the Israeli national pavilion from this year’s show to protest Israel’s war in Gaza. Those opposed to Israel’s presence had also vowed to protest on-site.Italy’s culture minister had firmly backed Israel’s participation, and the fair was opening amid unusually heightened security.Written in English, the announcement Tuesday of Israel’s delayed opening read: “The artist and curators of the Israeli pavilion will open the exhibition when a ceasefire and hostage release agreement is reached.” Two Italian soldiers stood guard nearby.Adriano Pedrosa, the Brazilian curator of the main show at the Biennale, praised the gesture.“It’s a very courageous decision,” Pedrosa told The Associated Press. “I think it’s a very wise decision as well” because it is “very difficult to present a work in this particular context.”The national pavilions at Venice are independent of the main show, and each nation decides its own show, which may or may not play into the curator’s vision.Palestinian artists are participating in collateral events in Venice and three Palestinian artists’ works are to appear in Pedrosa’s main show, titled “Stranieri Ovunque — Foreigners Everywhere,” which has a preponderance of artists from the global south.Pedrosa, the artistic director of Brazil’s Sao Paulo Museum of Art, said one of the Palestinian artists, New York-based Khaled Jarrar, was not physically in Venice because he couldn’t get a visa.Geopolitics is no stranger to the Biennale. The festival discouraged, and then banned, South Africa’s participation during apartheid. Russian artists withdrew their participation in 2022 to protest the Kremlin’s invasion of Ukraine, and the Biennale said Russia did not request to participate in this year’s edition.The war in Gaza erupted after Hamas and Islamic Jihad carried out a cross-border attack on Oct. 7 that killed 1,200 people in Israel and kidnapped 250 others.Israel’s retaliatory offensive in Gaza has so far killed over 33,700 Palestinians, according to local health officials, causing widespread devastation. The United Nations has warned of imminent famine in northern Gaza.",2024-04-16 14:04:00 PM EEST,NBC,"Artist refuses to open Israeli pavilion at Venice Biennale until Gaza cease-fire, hostage release",https://www.nbcnews.com/news/world/venice-biennale-artist-israel-gaza-cease-fire-hostages-rcna147970
Variety,"Giancarlo Esposito  appeared on a recent episode of  SiriusXM’s “Jim & Sam”  show while promoting his new AMC drama series “Parish” and revealed that he was so broke prior to landing his iconic role of Gus Fring on  “Breaking Bad”  that he once considered arranging his own murder so that his children could have some financial protection courtesy of his life insurance money. The actor considered this around 2008, a year before “Breaking Bad” inextricably changed his career and opened the door for roles in “The Mandalorian,” “The Boys” and more.Asked how he got out of near bankruptcy around 2008, Esposito said, “My way out in my brain was: ‘Hey, do you get life insurance if someone commits suicide? Do they get the bread?’ My wife had no idea why I was asking this stuff. I started scheming. If I got somebody to knock me off, death by misadventure, [my kids] would get the insurance. I had four kids. I wanted them to have a life. It was a hard moment in time. I literally thought of self-annihilation so they could survive. That’s how low I was.”“That was the first inkling that there was a way out, but I wouldn’t be here to be available to my kids,” Esposito added. “Then I started to think that’s not viable because the pain I would cause them would be lifelong, and there’d be lifelong trauma that would just extend the generational trauma I’m trying to move away from. The light at the end of the tunnel was ‘Breaking Bad.’”Esposito appeared as Gus Fring on 26 episodes of “Breaking Bad,” then reprised the role on the prequel series “Better Call Saul” for 34 episodes. He told  British GQ  earlier this year that he is highly interested in playing Gus for a third time in a prequel series about the villain.“Yeah, I would love that,” he said. “My backstory is he was a military guy who worked his way up through the ranks and could have become president, even possibly the dictator and have taken over. But he wanted to do something that could not be controlled by others, and he wanted to control his own destiny. And so he took off to create a new life for himself in America and become a meth dealer, a businessman.”“I think, in his younger years, he was someone who could have been more Tony Montana,” Esposito continued. “But he worked his way into becoming level enough to listen, hear, and see through his emotional state. We would hope that it might be ‘The Rise of Gus.’”",2024-04-19 16:52:00 PM EEST,NBC,"Before 'Breaking Bad,' Giancarlo Esposito considered arranging his own murder for insurance money",https://www.nbcnews.com/pop-culture/pop-culture-news/breaking-bad-giancarlo-esposito-considered-arranging-murder-insurance-rcna148542
